{
  "schema": "fireviewer.omniverse-reproducible-download-bundle-contract.v1",
  "contract_version": 1,
  "contract_status": "candidate_pending_die_visual_acceptance",
  "bundle": {
    "bundle_id": "fireviewer-die-2026-reproduction-download-r1",
    "revision": 1,
    "kind": "historical_reproduction",
    "root_directory": "fireviewer-die-2026-reproduction-download-r1",
    "entry_stage": "dataset.usda",
    "entry_stage_sha256": null,
    "manifest_sha256": null,
    "archive_path": null,
    "archive_sha256": null
  },
  "case_reference": {
    "contract_record": "examples/die-retrospective-case.candidate.json",
    "contract_record_sha256": "caf966c562e9e20d5388e8882b7deacc6827569e2530c77b16301c1e32916493",
    "case_id": "die-2026-retrospective-replay-v1",
    "package_id": "fireviewer-die-pontaix-map-r5-die-retrospective-v2",
    "required_status": "active"
  },
  "dependency_locks": [
    {"role": "map_contract", "path": "contracts/map-contract.json", "sha256": null, "inside_bundle": true},
    {"role": "map_manifest", "path": "map/manifest.json", "sha256": null, "inside_bundle": true},
    {"role": "perimeter_contract", "path": "contracts/perimeter-contract.json", "sha256": null, "inside_bundle": true},
    {"role": "perimeter_manifest", "path": "perimeters/manifest.json", "sha256": null, "inside_bundle": true},
    {"role": "camera_rig", "path": "cameras/fixed_cameras.usda", "sha256": "ff18d01047777fe17ab2c6715a3d9ef27d656151fc582d6bcc1827858eeeef13", "inside_bundle": true},
    {"role": "scenario", "path": "scenarios/scenario.usda", "sha256": null, "inside_bundle": true},
    {"role": "flow", "path": "scenarios/flow.usda", "sha256": null, "inside_bundle": true},
    {"role": "runtime_contract", "path": "runtime/runtime-contract.json", "sha256": null, "inside_bundle": true},
    {"role": "source_truth", "path": "source/die-2026-v1.json", "sha256": "9a1743f84aae2283d251d689b842ed34363e56b2da6c0807e3aec750e5cc9e7d", "inside_bundle": true},
    {"role": "asset_inventory", "path": "dependency-inventory.json", "sha256": null, "inside_bundle": true}
  ],
  "reproducibility": {
    "seed": 20260703,
    "timeline_seconds_per_day": 60.0,
    "state_selection": "deterministic",
    "camera_selection": "deterministic_seeded_random",
    "camera_retargeting": "nearest_visible_flame_point_to_camera",
    "runtime_lock": {
      "kit_application": "FireViewer Kit / Isaac Sim",
      "kit_version": "locked-by-runtime-contract",
      "required_extensions": ["omni.flowusd", "omni.replicator.core"],
      "python_lock_path": "runtime/python-lock.json"
    },
    "source_snapshots_embedded": true
  },
  "portability": {
    "self_contained": true,
    "relative_paths_only": true,
    "absolute_paths_present": false,
    "remote_urls_present": false,
    "symlinks_present": false,
    "dependency_inventory_sha256": null,
    "isolated_reopen": "not_run"
  },
  "access_scope": {
    "audience": "authenticated_account_holders",
    "applies_to": ["simulated_cases", "historical_reproductions"],
    "map_upload_included": false,
    "backend_implementation_in_scope": false
  },
  "quality_gates": {
    "case_active": "pending",
    "dependency_hashes": "pending",
    "relative_path_scan": "pending",
    "archive_integrity": "not_run",
    "isolated_kit_reopen": "not_run",
    "human_visual_review": "pending"
  },
  "release": {
    "human_visual_decision": "pending",
    "acceptance_receipt_sha256": null,
    "download_allowed": false,
    "dataset_capture_included": false,
    "training_admission_included": false,
    "automatic_publication": false
  }
}
